{
  "id": "synthetic-random-baseline-metrics-v0",
  "run_receipt": "run_receipt.json",
  "created_at": "2026-07-09T00:00:00Z",
  "sample": {
    "start_time": "2026-02-01T00:00:00Z",
    "end_time": "2026-02-12T00:00:00Z",
    "trades": 12,
    "signals": 12,
    "instruments": ["SYNTH"]
  },
  "gross_metrics": {
    "pnl": 0.005,
    "sharpe": 0.08,
    "max_drawdown": -0.018,
    "win_rate": 0.5,
    "turnover": 12
  },
  "net_metrics": {
    "pnl": -0.115,
    "sharpe": -1.65,
    "max_drawdown": -0.115,
    "win_rate": 0.0833,
    "turnover": 12
  },
  "robustness": {
    "null_baseline_result": "candidate is a deterministic random baseline and fails after costs",
    "dsr_or_psr": null,
    "pbo": null,
    "stress_results": ["cost drag dominates fixture returns"],
    "parameter_stability": "not applicable"
  },
  "limitations": ["Synthetic returns", "Illustrative costs", "No execution evidence"]
}
